{
  "always_run": false,
  "covers": {
    "change_types": [
      "SOURCE_CODE_CHANGED"
    ],
    "manifest_paths": [
      "source"
    ]
  },
  "expect": {
    "output_contains": [
      "OK:subgraph.frontend_tools_propagate"
    ]
  },
  "id": "subgraph.frontend_tools_propagate",
  "risk": "high",
  "tags": [
    "external-validation",
    "batch1"
  ],
  "title": "Frontend tools reach child LangGraph agents"
}
