{
  "id": "mcp.unknown_inventory_requires_approval",
  "title": "Unknown MCP inventory fails closed to approval",
  "risk": "medium",
  "tags": ["mcp", "inventory"],
  "always_run": false,
  "covers": {"change_types": ["SYSTEM_INSTRUCTION_CHANGED"]},
  "expect": {"output_contains": ["inventory unavailable"]}
}
